{
  "schema": "gate-trace-matrix/v0",
  "producer": "TEA trace (bmad-testarch-trace) · oracle formal_requirements/high · keys=basename · via tea-to-trace-matrix/v0",
  "gateStatus": "CONCERNS",
  "requirements": [
    {
      "id": "REQ-BOOKING-OVERLAP",
      "priority": "P0",
      "status": "FULL",
      "tests": [
        "booking.spec.ts::rejects overlapping bookings"
      ],
      "teaCoverage": "FULL"
    },
    {
      "id": "REQ-BOOKING-CONFIRM",
      "priority": "P0",
      "status": "FULL",
      "tests": [
        "booking.spec.ts::confirms a valid booking"
      ],
      "teaCoverage": "FULL"
    },
    {
      "id": "REQ-BOOKING-FEE",
      "priority": "P1",
      "status": "PARTIAL",
      "tests": [
        "booking.spec.ts::shows the cancellation fee"
      ],
      "teaCoverage": "UNIT-ONLY"
    },
    {
      "id": "REQ-BOOKING-ERROR-LOG",
      "priority": "P1",
      "status": "FULL",
      "tests": [
        "booking.spec.ts::logs a booking error"
      ],
      "teaCoverage": "FULL"
    },
    {
      "id": "REQ-BOOKING-EXPORT",
      "priority": "P2",
      "status": "PARTIAL",
      "tests": [
        "booking.spec.ts::exports a booking receipt"
      ],
      "teaCoverage": "INTEGRATION-ONLY"
    },
    {
      "id": "REQ-BOOKING-ROOMLIST",
      "priority": "P1",
      "status": "FULL",
      "tests": [
        "booking.spec.ts::renders the room list",
        "booking.spec.ts::disables submit while pending"
      ],
      "teaCoverage": "FULL"
    },
    {
      "id": "REQ-BOOKING-A11Y",
      "priority": "P2",
      "status": "FULL",
      "tests": [
        "booking.spec.ts::meets contrast requirements"
      ],
      "teaCoverage": "FULL"
    },
    {
      "id": "REQ-BOOKING-SLA",
      "priority": "P3",
      "status": "NONE",
      "tests": [],
      "teaCoverage": "NONE"
    }
  ]
}
